checked_link,countries,date,id,justify,label,poynter_link,source,title
https://www.aosfatos.org/noticias/nao-ha-fontes-que-comprovem-queda-de-30-na-venda-de-produtos-chineses-em-sc/,Brazil,2020-09-03 00:00:00,243,explanation the only public number available  from the ministry of economy  indicates a decrease of 62 in the value of total imports from the state between january and july this year compared to the same period in 2019 however  the database doesnt segment the information by origin of the merchandise,FALSE,https://www.poynter.org/?ifcn_misinformation=chinese-product-sales-suffer-30-drop-in-the-brazilian-state-of-santa-catarina, Aos Fatos, chinese product sales suffer 30 drop in the brazilian state of santa catarina
https://piaui.folha.uol.com.br/lupa/2020/09/03/verificamos-cdc-obitos-pandemia/,Brazil,2020-09-03 00:00:00,244,explanation according to cdc  this is a misinterpretation of their data 6 of covid19 deaths in the united states had the diseases as the only cause in their death certificate but the other 94 included patients that had covid19 related complications  like pneumonia and respiratory failure,FALSE,https://www.poynter.org/?ifcn_misinformation=cdc-data-shows-that-only-6-of-covid-19-victims-were-killed-by-the-coronavirus-alone, Agência Lupa, cdc data shows that only 6 of covid19 victims were killed by the coronavirus alone
https://politica.estadao.com.br/blogs/estadao-verifica/video-dissemina-informacoes-falsas-para-afirmar-que-a-pandemia-e-um-plano-de-controle-populacional/,Brazil,2020-09-03 00:00:00,245,explanation the information used in the video is completely false the man who appears on the video says there is a plan to reduce earths population in 80,FALSE,https://www.poynter.org/?ifcn_misinformation=the-pandemic-is-a-plan-to-control-the-population, Estadão Verifica, the pandemic is a plan to control the population
https://www.aosfatos.org/noticias/e-falso-que-pesquisa-americana-disse-que-so-6-das-vitimas-de-covid-19-morreram-pela-infeccao/,Brazil,2020-09-02 00:00:00,246,explanation according to the cdc  the interpretation is wrong  since 92 of deaths registered by the infection in that country cite covid19 as the basic cause of death in addition  the list of comorbidities includes acute conditions that may have occurred as a result of the covid19 infection  such as pneumonia  respiratory failure or infections caused during hospitalization,FALSE,https://www.poynter.org/?ifcn_misinformation=cdc-survey-shows-that-only-6-of-covid-19-victims-were-killed-by-the-coronavirus-says-brazilian-journalist-on-video, Aos Fatos, cdc survey shows that only 6 of covid19 victims were killed by the coronavirus says brazilian journalist on video
https://piaui.folha.uol.com.br/lupa/2020/09/01/verificamos-fda-china-cloroquina/,Brazil,2020-09-01 00:00:00,247,explanation neither china  nor the fda have ever stated chloroquine is an 100 efficient covid19 treatment the fda retracted the emergency use authorization for chloroquine against covid19 in june china does allow its use  but publicly acknowledge there are no scientifically proved treatments for the disease,FALSE,https://www.poynter.org/?ifcn_misinformation=china-and-the-fda-confirmed-that-chloroquine-is-100-effective-against-covid-19, Agência Lupa, china and the fda confirmed that chloroquine is 100 effective against covid19
https://piaui.folha.uol.com.br/lupa/2020/09/01/verificamos-franca-italia-cloroquina/,Brazil,2020-09-01 00:00:00,248,explanation neither of these countries reccomend chloroquine as a standard treatment against covid19,FALSE,https://www.poynter.org/?ifcn_misinformation=france-italy-and-the-united-kingdom-followed-on-jair-bolsonaros-steps-and-now-recommend-chloroquine-as-standard-treatment-for-covid-19, Agência Lupa, france italy and the united kingdom followed on jair bolsonaros steps and now recommend chloroquine as standard treatment for covid19
https://piaui.folha.uol.com.br/lupa/2020/09/01/verificamos-covid-certificado-vacinacao/,Brazil,2020-09-01 00:00:00,249,explanation this acronym only makes sense in italian covid means coronavirus diseases,FALSE,https://www.poynter.org/?ifcn_misinformation=covid-19-means-identification-certificate-of-artificial-intelligence-vaccine-its-being-used-as-a-form-of-population-control, Agência Lupa, covid19 means identification certificate of artificial intelligence vaccine its being used as a form of population control
https://www.aosfatos.org/noticias/e-falso-que-foto-da-praia-de-ipanema-lotada-publicada-pelo-estadao-seja-antiga/,Brazil,2020-09-01 00:00:00,250,explanation the image was recorded on august 30  as shown in the photo file data,FALSE,https://www.poynter.org/?ifcn_misinformation=photo-of-crowded-rio-de-janeiro-beach-published-by-brazilian-newspaper-wasnt-recorded-during-the-pandemic, Aos Fatos, photo of crowded rio de janeiro beach published by brazilian newspaper wasnt recorded during the pandemic
https://www.aosfatos.org/noticias/e-falso-que-oms-admitiu-erro-e-se-desculpou-por-posicionamento-sobre-hidroxicloroquina/,Brazil,2020-08-31 00:00:00,251,explanation the information was denied by telephone by paho pan american health organization  which represents the who in brazil,FALSE,https://www.poynter.org/?ifcn_misinformation=who-apologizes-for-taking-a-stand-against-hydroxychloroquine, Aos Fatos, who apologizes for taking a stand against hydroxychloroquine
https://www.aosfatos.org/noticias/covid-19-nao-quer-dizer-certificado-internacional-de-vacinacao-com-inteligencia-artificial/,Brazil,2020-09-01 00:00:00,252,explanation the term means corona virus disease in the recording  the doctor is also misleading when he says that vaccines weaken the immune system  when  in fact  the doses strengthen the bodys defenses the assertion that no test is able to detect the new coronavirus is also false,FALSE,https://www.poynter.org/?ifcn_misinformation=italian-doctor-claims-on-video-that-covid-19-stands-for-international-certificate-of-vaccination-with-artificial-intelligence, Aos Fatos, italian doctor claims on video that covid19 stands for international certificate of vaccination with artificial intelligence
https://piaui.folha.uol.com.br/lupa/2020/08/31/verificamos-lojas-americanas-estoque-pandemia/,Brazil,2020-08-31 00:00:00,253,explanation this is a phishing scam,FALSE,https://www.poynter.org/?ifcn_misinformation=lojas-americanas-a-retail-company-is-donating-62-million-reais-in-products-to-victims-of-covid-19, Agência Lupa, lojas americanas a retail company is donating 62 million reais in products to victims of covid19
https://factual.afp.com/la-foto-en-berlin-no-es-de-4-millones-contra-las-medidas-por-el-covid-19-es-de-un-festival-en-2003,Brazil,2020-09-01 00:00:00,254,explanation the photograph was taken in 2003 during the love parade  an electronic music festival in the german capital,FALSE,https://www.poynter.org/?ifcn_misinformation=an-aerial-image-supposedly-showing-the-demonstrations-that-day-in-berlin-against-the-restriction-measures-implemented-by-the-covid-19-pandemic, AFP, an aerial image supposedly showing the demonstrations that day in berlin against the restriction measures implemented by the covid19 pandemic
https://piaui.folha.uol.com.br/lupa/2020/08/31/verificamos-foto-aglomeracao-ipanema/,Brazil,2020-08-31 00:00:00,255,explanation the exif files shows the picture was actually taken in august 30 there are people wearing masks  which also indicate the photo is recent other photos published by estadão on the same day are also from august 30  according to their exif files,FALSE,https://www.poynter.org/?ifcn_misinformation=a-picture-published-by-o-estado-de-s-paulo-that-shows-an-agglomeration-at-ipanema-beach-allegedly-on-august-30-in-rio-de-janeiro-was-actually-taken-before-the-pandemic, Agência Lupa, a picture published by o estado de s paulo that shows an agglomeration at ipanema beach allegedly on august 30 in rio de janeiro was actually taken before the pandemic
https://politica.estadao.com.br/blogs/estadao-verifica/e-falso-que-etiopia-e-australia-recomendem-ivermectina-contra-covid-19/,Brazil,2020-08-20 00:00:00,256,explanation the main study with ivermectin is still to be tested in humans therefore  use of ivermectin to treat covid19 remains unproven,FALSE,https://www.poynter.org/?ifcn_misinformation=study-proved-efficacy-of-ivermectin-on-treatment-of-covid-19-the-medecin-is-given-by-government-to-treat-people-in-australia-and-ethiopia, Estadão Verifica, study proved efficacy of ivermectin on treatment of covid19 the medecin is given by government to treat people in australia and ethiopia
https://piaui.folha.uol.com.br/lupa/2020/08/20/verificamos-mortos-covid-causa/,Brazil,2020-08-20 00:00:00,257,explanation the ministry of health guidelines for death certificate emissions during the pandemic explicitly states that if the cause of death is unrelated to the infection  covid19 should only be mentioned on a separate section  not as the cause,FALSE,https://www.poynter.org/?ifcn_misinformation=everyone-who-dies-while-infected-with-the-sars-cov-2-is-registered-in-official-documents-as-dead-by-covid-19-even-if-the-death-is-unrelated-e-g-a-car-accident, Agência Lupa, everyone who dies while infected with the sarscov2 is registered in official documents as dead by covid19 even if the death is unrelated eg a car accident
https://piaui.folha.uol.com.br/lupa/2020/08/20/verificamos-uso-mascaras-desencorajado/,Brazil,2020-08-20 00:00:00,258,explanation all the mentioned institutions and people publicly recommend mask use masks are mandatory at least in some types of public space in almost every european country,FALSE,https://www.poynter.org/?ifcn_misinformation=the-who-cdc-and-the-surgeon-general-of-the-us-do-not-recommend-the-use-of-masks-by-regular-people-in-europe-mask-use-is-not-mandatory-anymore, Agência Lupa, the who cdc and the surgeon general of the us do not recommend the use of masks by regular people in europe mask use is not mandatory anymore
https://www.aosfatos.org/noticias/pesquisa-feita-na-usp-nao-prova-que-pessoas-em-confinamento-sao-mais-vulneraveis-covid-19/,Brazil,2020-08-19 00:00:00,259,explanation according to the company responsible for the study  the allegation doesnt correspond to the results  which only proves the presence of the new coronavirus suspended in the air and reinforces the importance of ventilation in closed environments,FALSE,https://www.poynter.org/?ifcn_misinformation=research-from-the-university-of-sao-paulo-proves-that-people-in-social-isolation-are-more-vulnerable-to-covid-19, Aos Fatos, research from the university of são paulo proves that people in social isolation are more vulnerable to covid19
https://politica.estadao.com.br/blogs/estadao-verifica/e-falso-que-estudo-de-2005-tenha-comprovado-cura-da-infeccao-por-coronavirus-com-cloroquina/,Brazil,2020-08-19 00:00:00,260,explanation the study cited describes the antiviral action of chloroquine in primate cells only it did not show capacity of curing covid19 also  the study foccused on sarscov  not sarscov2,FALSE,https://www.poynter.org/?ifcn_misinformation=physicians-knew-since-2005-that-chloroquine-cures-covid-19, Estadão Verifica, physicians knew since 2005 that chloroquine cures covid19
https://piaui.folha.uol.com.br/lupa/2020/08/18/verificamos-pesquisa-2005-cloroquina/,Brazil,2020-08-18 00:00:00,261,explanation this study showed that chloroquine is effective against the sars virus in cultured cells  but this doesnt mean its an effective treatment,FALSE,https://www.poynter.org/?ifcn_misinformation=a-2005-study-proved-that-chloroquine-is-an-effective-treatment-against-coronaviruses, Agência Lupa, a 2005 study proved that chloroquine is an effective treatment against coronaviruses
https://piaui.folha.uol.com.br/lupa/2020/08/18/verificamos-doria-usado-cloroquina/,Brazil,2020-08-18 00:00:00,262,explanation doria explictly said he was not taking chloroquine on the aforementioned interview,FALSE,https://www.poynter.org/?ifcn_misinformation=joao-doria-governor-of-sao-paulo-stated-he-was-taking-chloroquine-in-an-interview, Agência Lupa, joão doria governor of são paulo stated he was taking chloroquine in an interview
https://www.aosfatos.org/noticias/nao-e-verdade-que-estudo-aponte-que-maioria-das-pessoas-seja-imune-covid-19/,Brazil,2020-08-18 00:00:00,263,explanation the scientist never signed a research of this type and only mentioned  in an interview  the possibility that a portion of the population may be less susceptible to contracting the disease for reasons ranging from natural resistance to the lesser probability of exposure to the virus due to geographical isolation,FALSE,https://www.poynter.org/?ifcn_misinformation=karl-fristons-study-found-that-most-people-are-immune-to-the-new-coronavirus, Aos Fatos, karl fristons study found that most people are immune to the new coronavirus
https://www.aosfatos.org/noticias/e-falso-que-boicote-fez-venda-de-produtos-chineses-cair-70-em-santa-catarina/,Brazil,2020-08-17 00:00:00,264,explanation aos fatos didnt find any records of similar movements and the fcdl  sc federation of chambers of shopkeepers of santa catarina stated that they didnt know the data informed by the disinformation posts,FALSE,https://www.poynter.org/?ifcn_misinformation=after-boycott-chinese-product-sales-fell-70-in-the-brazilian-state-of-santa-catarina, Aos Fatos, after boycott chinese product sales fell 70 in the brazilian state of santa catarina
https://piaui.folha.uol.com.br/lupa/2020/08/17/verificamos-usp-isolamento-vulneraveis-covid/,Brazil,2020-08-17 00:00:00,265,explanation the study mentioned does not say anything about social isolation their analysis detected the presence of sarscov2 on the air in a hospital setting,FALSE,https://www.poynter.org/?ifcn_misinformation=a-study-from-the-university-of-sao-paulo-usp-proved-that-isolated-people-are-more-vulnerable-to-covid-19, Agência Lupa, a study from the university of são paulo usp proved that isolated people are more vulnerable to covid19
https://piaui.folha.uol.com.br/lupa/2020/08/14/verificamos-bioterroristas-sabotaram-sinalizacao/,Brazil,2020-08-14 00:00:00,266,explanation the image was doctored the original photo was taken in the us  on 2019  and the sign did not mention the pandemic,FALSE,https://www.poynter.org/?ifcn_misinformation=a-bioterrorist-hacked-a-digital-traffic-sign-and-wrote-end-this-lockdown-the-pandemic-is-a-farse, Agência Lupa, a bioterrorist hacked a digital traffic sign and wrote end this lockdown the pandemic is a farse
https://piaui.folha.uol.com.br/lupa/2020/08/14/verificamos-termometros-glandula-pineal/,Brazil,2020-08-14 00:00:00,267,explanation infrared thermometers do not emit infrared rays  it actually measures infrared waves produced by the body,FALSE,https://www.poynter.org/?ifcn_misinformation=infrared-thermometer-can-damage-the-pineal-gland, Agência Lupa, infrared thermometer can damage the pineal gland
https://piaui.folha.uol.com.br/lupa/2020/08/14/verificamos-mascaras-infeccao-bacteriana/,Brazil,2020-08-14 00:00:00,268,explanation 3 of the 5 pictures are prior to the pandemic one of them is current  but it shows temporary marks on the skin caused by n95 respirators  not a skin disease the origin of the fifth image is uncertain  but the skin disease is not compatible with staphylococcus bacteria,FALSE,https://www.poynter.org/?ifcn_misinformation=5-pictures-show-people-who-were-alledegedly-infected-with-staphylococcus-bacteria-because-of-masks-during-the-pandemic, Agência Lupa, 5 pictures show people who were alledegedly infected with staphylococcus bacteria because of masks during the pandemic
https://politica.estadao.com.br/blogs/estadao-verifica/posts-distorcem-dados-de-2019-e-2020-para-negar-as-mais-de-100-mil-mortes-por-covid-19/,Brazil,2020-08-14 00:00:00,269,explanation posts use data that is outdated to compare deaths in 2019 and 2020 their source of information is constantly updating  but posts hide that information,FALSE,https://www.poynter.org/?ifcn_misinformation=there-was-not-100000-deaths-of-covid-19-in-brazil-the-pandemic-is-a-fraud, Estadão Verifica, there was not 100000 deaths of covid19 in brazil the pandemic is a fraud
https://politica.estadao.com.br/blogs/estadao-verifica/imagem-de-flavio-dino-sem-mascara-em-velorio-e-de-2018/,Brazil,2020-08-27 00:00:00,270,explanation the image is true  but was taken in 2018,FALSE,https://www.poynter.org/?ifcn_misinformation=maranhao-states-governor-flavio-dino-caused-aglomeration-on-the-funeral-of-his-father, Estadão Verifica, maranhão states governor flávio dino caused aglomeration on the funeral of his father
https://www.aosfatos.org/noticias/termometro-infravermelho-nao-causa-danos-glandula-pineal/,Brazil,2020-08-14 00:00:00,271,explanation the thermometer does not emit infrared rays  as the posts claim it actually makes the measurement by capturing the infrared radiation emitted by the human body itself  explained the professors rickson mesquita  from the unicamp physics institute state university of campinas  and fabiano bernardi  from the physics institute of ufrgs federal university of rio grande do sul to aos fatos,FALSE,https://www.poynter.org/?ifcn_misinformation=infrared-thermometer-damages-the-pineal-gland, Aos Fatos, infrared thermometer damages the pineal gland
https://politica.estadao.com.br/blogs/estadao-verifica/e-falso-que-dilma-tenha-sugerido-rodizio-para-volta-as-aulas-durante-pandemia/,Brazil,2020-08-31 00:00:00,272,explanation former president never said that its a hoax,FALSE,https://www.poynter.org/?ifcn_misinformation=former-president-dilma-rousseff-defended-the-idea-of-having-students-rotating-in-schools-in-order-to-reopen-them, Estadão Verifica, former president dilma rousseff defended the idea of having students rotating in schools in order to reopen them
https://piaui.folha.uol.com.br/lupa/2020/08/28/verificamos-oms-hidroxicloroquina-erro/,Brazil,2020-08-28 00:00:00,273,explanation the who does not recommend hydroxichloroquine against covid19,FALSE,https://www.poynter.org/?ifcn_misinformation=the-who-apologised-and-started-to-recommend-hydroxichloroquine-against-covid-19, Agência Lupa, the who apologised and started to recommend hydroxichloroquine against covid19
https://piaui.folha.uol.com.br/lupa/2020/08/27/verificamos-flavio-dino-velorio-pai-covid-19/,Brazil,2020-08-27 00:00:00,274,explanation although flavio dinos father died of covid19  the images are not from his funeral they were shot in 2018,FALSE,https://www.poynter.org/?ifcn_misinformation=flavio-dino-governor-of-maranhao-was-filmed-without-a-mask-during-his-fathers-funeral-there-were-dozens-of-people-there-meanwhile-poor-peoples-funerals-in-maranhao-are-limited-to-10-atendees, Agência Lupa, flávio dino governor of maranhão was filmed without a mask during his fathers funeral there were dozens of people there meanwhile poor peoples funerals in maranhão are limited to 10 atendees
https://piaui.folha.uol.com.br/lupa/2020/08/27/verificamos-golpe-cestas-extra/,Brazil,2020-08-27 00:00:00,275,explanation this is a phishing scam,FALSE,https://www.poynter.org/?ifcn_misinformation=extra-a-brazilian-supermarket-chain-is-distributing-15-million-reais-worth-of-products-to-vulnerable-families-during-the-pandemic, Agência Lupa, extra a brazilian supermarket chain is distributing 15 million reais worth of products to vulnerable families during the pandemic
https://politica.estadao.com.br/blogs/estadao-verifica/e-falso-que-vacina-contra-covid-19-cause-danos-irreversiveis-ao-dna/,Brazil,2020-08-27 00:00:00,276,explanation there is no evidence that vaccines made of mrna can cause harm scientific research suggests they are safe,FALSE,https://www.poynter.org/?ifcn_misinformation=covid-19-vaccines-cause-irreversible-changes-in-the-dna-2, Estadão Verifica, covid19 vaccines cause irreversible changes in the dna
,,2020-08-27 00:00:00,277,explanation ,,https://www.poynter.org/?ifcn_misinformation=covid-19-vaccines-cause-irreversible-changes-in-the-dna, , covid19 vaccines cause irreversible changes in the dna
https://piaui.folha.uol.com.br/lupa/2020/08/26/verificamos-leticia-spiller-bolsonaristas-coronavirus/,Brazil,2020-08-26 00:00:00,278,explanation theres no evidence spiller made these remarks,FALSE,https://www.poynter.org/?ifcn_misinformation=actress-leticia-spiller-said-in-social-media-that-bolsonaro-supporters-deserve-to-die-of-covid-19, Agência Lupa, actress letícia spiller said in social media that bolsonaro supporters deserve to die of covid19
https://piaui.folha.uol.com.br/lupa/2020/08/24/verificamos-neurocientista-estudo-imune/,Brazil,2020-08-25 00:00:00,279,explanation by email  friston said this number refers to what he calls immunological dark matter  people who are not going to be affected by the virus for several reasons this does not mean immunity also  he said lockdown and social isolation are important mitigation strategies against covid19,FALSE,https://www.poynter.org/?ifcn_misinformation=british-neuroscientist-karl-friston-published-a-study-proving-80-of-the-population-is-immune-to-covid-19-he-also-said-lockdown-is-useless-and-based-on-faulty-science, Agência Lupa, british neuroscientist karl friston published a study proving 80 of the population is immune to covid19 he also said lockdown is useless and based on faulty science
https://piaui.folha.uol.com.br/lupa/2020/08/26/verificamos-epi-mulher-covid/,Brazil,2020-08-26 00:00:00,280,explanation the equipment shown in the photo is not the same used by covid19 frontline workers,FALSE,https://www.poynter.org/?ifcn_misinformation=a-nurse-was-photographed-in-a-deli-wearing-protective-clothes-meant-only-to-be-used-while-treating-covid-19-patients, Agência Lupa, a nurse was photographed in a deli wearing protective clothes meant only to be used while treating covid19 patients
https://www.aosfatos.org/noticias/video-de-alimentos-desenterrados-em-escola-nao-tem-relacao-com-governo-do-rn/,Brazil,2020-08-25 00:00:00,281,explanation the video used to sustain this claim was recorded on the ground of a municipal school outside the purview of bahias government and the school director denied having received guidance from the government,FALSE,https://www.poynter.org/?ifcn_misinformation=government-of-the-brazilian-state-of-bahia-directs-schools-to-bury-food-sent-by-the-federal-government-during-the-pandemic-to-blame-president-jair-bolsonaro, Aos Fatos, government of the brazilian state of bahia directs schools to bury food sent by the federal government during the pandemic to blame president jair bolsonaro
https://www.aosfatos.org/noticias/nao-e-verdade-que-tomar-vinagre-com-alho-cure-covid-19/,Brazil,2020-08-21 00:00:00,282,explanation who world health organization points out that garlic is a healthy food that may have some antimicrobial properties  but that has no evidence that it is effective against covid19 a review of studies carried out by fiocruz fundação oswaldo cruz in april says that garlic has therapeutic potential against some types of viruses of common respiratory syndromes  cases of flu and cold  but that nothing related to covid 19,FALSE,https://www.poynter.org/?ifcn_misinformation=taking-vinegar-with-raw-garlic-cures-covid-19, Aos Fatos, taking vinegar with raw garlic cures covid19
https://www.aosfatos.org/noticias/nao-e-verdade-que-camila-pitanga-anunciou-que-teve-covid-19-em-vez-de-malaria/,Brazil,2020-08-21 00:00:00,283,explanation the news  which was being shared as if it were true  was originally published by a parody profile on twitter,FALSE,https://www.poynter.org/?ifcn_misinformation=brazilian-actress-camila-pitanga-announced-that-her-malaria-test-was-incorrect-and-that-in-fact-she-was-diagnosed-with-covid-19, Aos Fatos, brazilian actress camila pitanga announced that her malaria test was incorrect and that in fact she was diagnosed with covid19
https://politica.estadao.com.br/blogs/estadao-verifica/relacao-entre-vibracao-alta-e-covid-19-nao-tem-comprovacao-cientifica/,Brazil,2020-08-21 00:00:00,284,explanation there is no scientific evidence to support these claims,FALSE,https://www.poynter.org/?ifcn_misinformation=sars-cov-2-vibrates-in-55-hz-frequency-and-dies-above-255-hz, Estadão Verifica, sarscov2 vibrates in 55 hz frequency and dies above 255 hz
https://politica.estadao.com.br/blogs/estadao-verifica/assessor-de-bolsonaro-utiliza-informacao-desatualizada-para-insinuar-fraude-no-registro-de-obitos-causados-pela-covid-19/,Brazil,2020-08-20 00:00:00,285,explanation the special advisor used an outdated report from a small townhall to suggest that the pandemic numbers in brazil were being invented the townhall corrected the report before the special advisor tweeted about it,FALSE,https://www.poynter.org/?ifcn_misinformation=there-are-frauds-on-the-death-toll-related-to-covid-19, Estadão Verifica, there are frauds on the death toll related to covid19
https://piaui.folha.uol.com.br/lupa/2020/08/11/verificamos-julho-2020-menos-mortes-pandemia/,Brazil,2020-08-11 00:00:00,286,explanation the numbers for july 2020 are not yet fully accounted on the civil registry website  but it is already larger then july 2019,FALSE,https://www.poynter.org/?ifcn_misinformation=according-to-the-civil-registry-less-people-died-in-july-2020-than-in-july-2019-despite-the-pandemic, Agência Lupa, according to the civil registry less people died in july 2020 than in july 2019 despite the pandemic
