checked_link,countries,date,id,justify,label,poynter_link,source,title
https://politica.estadao.com.br/blogs/estadao-verifica/e-falso-que-repasses-a-estados-estejam-relacionados-ao-numero-de-mortos-pelo-novo-coronavirus/,Brazil,2020-06-22 00:00:00,459,explanation there is no record of any investigation into the alleged fraud government transfers are not related to the number of deaths by covid19,FALSE,https://www.poynter.org/?ifcn_misinformation=a-video-of-a-nurse-claiming-that-60-percent-of-covid-19-victims-died-from-other-diseases-and-that-public-authorities-are-increasing-the-numbers-to-receive-more-money, Estadão Verifica, a video of a nurse claiming that 60 percent of covid19 victims died from other diseases and that public authorities are increasing the numbers to receive more money
https://www.aosfatos.org/noticias/e-falso-que-oms-disse-que-coronavac-nao-foi-testada-em-nenhum-lugar-do-mundo/,Brazil,2020-06-19 00:00:00,460,explanation the vaccine has already undergone two phases of testing and was administered to 744 chinese people,FALSE,https://www.poynter.org/?ifcn_misinformation=who-says-coronavac-vaccine-produced-by-sinovac-biotech-hasnt-been-tested-anywhere-in-the-world-before-brazil, Aos Fatos, who says coronavac vaccine produced by sinovac biotech hasnt been tested anywhere in the world before brazil
https://politica.estadao.com.br/blogs/estadao-verifica/uso-da-cloroquina-nao-explica-a-situacao-da-pandemia-no-senegal/,Brazil,2020-06-19 00:00:00,461,explanation senegal uses chloroquine as a treatment for covid19 doctor mussa seydi defends the drug  but says it is not the only reason why deaths are such low,FALSE,https://www.poynter.org/?ifcn_misinformation=senegalese-doctor-says-chloroquine-is-the-secret-for-a-very-low-number-of-deaths-by-covid-19-in-senegal, Estadão Verifica, senegalese doctor says chloroquine is the secret for a very low number of deaths by covid19 in senegal
https://piaui.folha.uol.com.br/lupa/2020/06/19/verificamos-trump-supremo-pandemia/,Brazil,2020-06-19 00:00:00,462,explanation trump did not mention in any occasion the brazilian supreme court or governors  the entire quote is a complete fabrication,FALSE,https://www.poynter.org/?ifcn_misinformation=donald-trump-said-brazil-is-the-only-country-in-which-the-supreme-court-is-hampering-the-national-governments-ability-to-deal-with-covid-19-also-he-criticized-brazilian-state-governors, Agência Lupa, donald trump said brazil is the only country in which the supreme court is hampering the national governments ability to deal with covid19 also he criticized brazilian state governors
https://www.aosfatos.org/noticias/enfermeiro-engana-ao-dizer-em-video-que-estados-e-municipios-faturam-com-mortes-por-covid-19/,Brazil,2020-06-19 00:00:00,463,explanation the extra resource for combating the pandemic provided by the brazilian ministry of health varies according to the size of the population and the complexity of the service provided in the health units  not by the volume of deaths in the region,FALSE,https://www.poynter.org/?ifcn_misinformation=nurse-says-brazilian-states-and-municipalities-earn-federal-funding-for-every-death-recorded-for-covid-19, Aos Fatos, nurse says brazilian states and municipalities earn federal funding for every death recorded for covid19
https://www.aosfatos.org/noticias/azitromicina-ivermectina-e-nitazoxanida-nao-tem-eficacia-comprovada-contra-covid-19/,Brazil,2020-06-19 00:00:00,464,explanation there is still no effective remedy against the infection  according to scientists  medical entities and health authorities in addition  selfmedication with these compounds can pose health risks,FALSE,https://www.poynter.org/?ifcn_misinformation=when-symptoms-of-covid-19-appear-people-should-take-azithromycin-ivermectin-and-anitta, Aos Fatos, when symptoms of covid19 appear people should take azithromycin ivermectin and anitta
https://piaui.folha.uol.com.br/lupa/2020/06/19/verificamos-doria-vacina-idosos/,Brazil,2020-06-19 00:00:00,465,explanation doria never said that the eligibility criteria for volunteers is not decided by state governors  but by the company and their partners in brazil  instituto butantan these criteria have not been fixed yet paying medical research subjects is illegal in brazil,FALSE,https://www.poynter.org/?ifcn_misinformation=joao-doria-governor-of-sao-paulo-said-coronavac-the-chinese-vaccine-that-will-be-tested-in-brazil-will-be-tested-only-on-elderly-people-who-will-receive-1-5-thousand-reais-around-250-american-do, Agência Lupa, joão doria governor of são paulo said coronavac the chinese vaccine that will be tested in brazil will be tested only on elderly people who will receive 15 thousand reais around 250 american dollars
https://piaui.folha.uol.com.br/lupa/2020/06/17/verificamos-saco-defuntos-sp/,Brazil,2020-06-17 00:00:00,466,explanation the video shows a police officer in amazonas who invaded a hospital because he thought his mother was about to be buried alive he watched a disinformative video on whatsapp about a woman who was  allegedly  put inside a corpse bag while still breathing  and thought it was his mother because they wore the same dress this particular video has been previously debunked too,FALSE,https://www.poynter.org/?ifcn_misinformation=a-police-officer-from-sao-paulo-rescued-his-mother-while-she-was-about-to-be-buried-alive, Agência Lupa, a police officer from são paulo rescued his mother while she was about to be buried alive
https://voxukraine.org/uk/nepravda-brazilski-deputati-vikrili-likarnyu-yaka-stverdzhuvala-shho-u-nij-likuyetsya-5000-hvorih/,Ukraine- Brazil,2020-06-17 00:00:00,467,explanation the video shows the mps visit to the unfinished field hospital  where no one is being treated yet,FALSE,https://www.poynter.org/?ifcn_misinformation=brazilian-mps-revealed-the-hospital-claiming-it-treats-5000-covid-19-patients, VoxCheck, brazilian mps revealed the hospital claiming it treats 5000 covid19 patients
https://politica.estadao.com.br/blogs/estadao-verifica/e-falso-que-stf-tenha-sido-responsavel-pela-soltura-de-32-mil-presos-por-causa-da-covid-19/,Brazil,2020-06-16 00:00:00,468,explanation decision to take non violent prisoners into home prison is up to state courts there was a recommendation from national justice council to do it so in order to prevent mass contaminations of covid19 inside prisons  but it was not a recommendation from the supreme court,FALSE,https://www.poynter.org/?ifcn_misinformation=supreme-court-released-32000-prisoners-because-of-covid-19, Estadão Verifica, supreme court released 32000 prisoners because of covid19
https://www.aosfatos.org/noticias/e-falso-que-policia-apreendeu-dinheiro-na-casa-do-secretario-de-saude-de-belem/,Brazil,2020-06-17 00:00:00,469,explanation the video was recorded during a police operation in the city of barcarena in the brazilian state of pará against six military police officers accused of embezzling seized cocaine,FALSE,https://www.poynter.org/?ifcn_misinformation=video-shows-police-seizing-money-diverted-from-respirators-at-the-home-of-the-health-secretary-of-the-brazilian-city-of-belem, Aos Fatos, video shows police seizing money diverted from respirators at the home of the health secretary of the brazilian city of belém
https://piaui.folha.uol.com.br/lupa/2020/06/15/verificamos-doria-vacina-butantan/,Brazil,2020-06-15 00:00:00,470,explanation doria never said he signed a contract with sinovac in 2019 what he actually said is that the partnership between sinovac and the state government of são paulo to test a covid19 vaccine  signed in june 2020  was only possible because a commercial representation was set up in shanghai on august 2019,FALSE,https://www.poynter.org/?ifcn_misinformation=joao-doria-governor-of-sao-paulo-signed-a-contract-with-sinovac-to-develop-a-vaccine-against-covid-19-in-august-therefore-he-knew-all-about-the-disease-and-is-part-of-a-chinese-conspiracy, Agência Lupa, joão doria governor of são paulo signed a contract with sinovac to develop a vaccine against covid19 in august therefore he knew all about the disease and is part of a chinese conspiracy
https://politica.estadao.com.br/blogs/estadao-verifica/e-falso-que-ministerio-da-saude-tenha-determinado-mudanca-no-registro-de-mortes-suspeitas-de-covid-19/,Brazil,2020-06-15 00:00:00,471,explanation health ministery denies the minister said that also states that cases in which covid19 wasnt confirmed yet are classified as cases under investigation in that sense  they do not get countered on death toll,FALSE,https://www.poynter.org/?ifcn_misinformation=brazils-health-minister-says-cases-with-no-confirmation-of-covid-19-wont-be-considered-on-death-toll, Estadão Verifica, brazils health minister says cases with no confirmation of covid19 wont be considered on death toll
https://politica.estadao.com.br/blogs/estadao-verifica/stf-nao-barrou-atendimento-a-pacientes-com-covid-19-em-hospitais-militares/,Brazil,2020-06-15 00:00:00,472,explanation a decision in that sense was taken by a federal court  not the supreme court also  it determined that opening army hospitals for common population is a decision that has to come from governors and mayors  not from judiciary,FALSE,https://www.poynter.org/?ifcn_misinformation=brazilian-supreme-court-denied-order-for-army-hospitals-to-treat-covid-19-patients, Estadão Verifica, brazilian supreme court denied order for army hospitals to treat covid19 patients
https://www.aosfatos.org/noticias/e-falso-que-doria-fechou-contrato-com-chineses-em-2019-para-vacina-contra-o-novo-coronavirus/,Brazil,2020-06-15 00:00:00,473,explanation the agreement between the government of são paulo and chinas sinovac biotech was signed on june 10 2020 in august 2019  the são paulo government just opened a commercial office in shanghai,FALSE,https://www.poynter.org/?ifcn_misinformation=governor-of-sao-paulo-said-he-signed-a-contract-with-china-for-the-production-of-a-coronavirus-vaccine-in-august-2019-which-proves-that-the-pandemic-is-a-scam, Aos Fatos, governor of são paulo said he signed a contract with china for the production of a coronavirus vaccine in august 2019 which proves that the pandemic is a scam
https://piaui.folha.uol.com.br/lupa/2020/06/12/verificamos-rapaz-reanimar-covid/,Brazil,2020-06-12 00:00:00,474,explanation the photo is true and current  but it was taken in mexico,FALSE,https://www.poynter.org/?ifcn_misinformation=photo-of-a-man-trying-to-ressurect-his-grandmother-through-mouth-to-mouth-breathing-according-to-the-caption-the-photo-was-taken-in-minas-gerais-brazil, Agência Lupa, photo of a man trying to ressurect his grandmother through mouthtomouth breathing according to the caption the photo was taken in minas gerais brazil
https://piaui.folha.uol.com.br/lupa/2020/06/12/verificamos-h1n1-covid-mortes/,Brazil,2020-06-12 00:00:00,475,explanation officially  18 thousand deaths were confirmed during the h1n1 pandemic currently  more than 400 thousand deaths have been confirmed for covid19,FALSE,https://www.poynter.org/?ifcn_misinformation=h1n1-caused-more-deaths-during-the-2009-pandemic-than-covid-19-yet-nobody-talked-about-it, Agência Lupa, h1n1 caused more deaths during the 2009 pandemic than covid19 yet nobody talked about it
https://www.aosfatos.org/noticias/projeto-aprovado-pela-camara-nao-obriga-usar-mascara-dentro-de-casa/,Brazil,2020-06-12 00:00:00,476,explanation in fact  the text of the law project states that the obligation only applies to public spaces or private places accessible to the public such as shops and churches,FALSE,https://www.poynter.org/?ifcn_misinformation=project-approved-by-the-brazilian-chamber-of-deputies-requires-the-use-of-masks-inside-homes, Aos Fatos, project approved by the brazilian chamber of deputies requires the use of masks inside homes
https://politica.estadao.com.br/blogs/estadao-verifica/post-distorce-informacoes-sobre-eficacia-da-ivermectina/,Brazil,2020-06-12 00:00:00,477,explanation doctor supports the use of the drug to treat patients with covid19 but denies that it is the cure for the disease also  the person whos quoted said posts and bloggers exagerated what he had said about the drug,FALSE,https://www.poynter.org/?ifcn_misinformation=ivermectin-is-the-cure-for-covid-19, Estadão Verifica, ivermectin is the cure for covid19
https://politica.estadao.com.br/blogs/estadao-verifica/foto-de-aniversario-de-haddad-e-tirada-de-contexto-para-acusar-petista-de-furar-quarentena/,Brazil,2020-06-12 00:00:00,478,explanation photo is from 2019,FALSE,https://www.poynter.org/?ifcn_misinformation=former-brazilian-presidential-candidate-fernando-haddad-celebrates-his-birthday-with-a-bunch-of-guests-during-the-covid-19-pandemic, Estadão Verifica, former brazilian presidential candidate fernando haddad celebrates his birthday with a bunch of guests during the covid19 pandemic
https://politica.estadao.com.br/blogs/estadao-verifica/fala-da-oms-sobre-transmissao-por-assintomaticos-e-distorcida-nas-redes/,Brazil,2020-06-11 00:00:00,479,explanation interview with maria van kerkhove  oms technique director  was misunderstood she said they dont know yet how covid19 is transmitted from people without symptons she said studies about it are rare  but it was understood that transmition from people without symptons was rare oms came one day after to state clearly that people with no symptons sure can transmite the disease,FALSE,https://www.poynter.org/?ifcn_misinformation=oms-says-people-infected-with-covid-19-without-symptons-do-not-transmit-the-disease, Estadão Verifica, oms says people infected with covid19 without symptons do not transmit the disease
https://politica.estadao.com.br/blogs/estadao-verifica/joao-doria-nao-falou-de-duplicidade-nas-mortes-de-covid-19/,Brazil,2020-06-11 00:00:00,480,explanation this rumour was invented  the governor never said that,FALSE,https://www.poynter.org/?ifcn_misinformation=sao-paulos-governor-joao-doria-admits-deaths-caused-by-covid-19-are-recorded-twice, Estadão Verifica, são paulos governor joão doria admits deaths caused by covid19 are recorded twice
https://politica.estadao.com.br/blogs/estadao-verifica/automedicacao-em-casos-de-covid-19-e-perigosa-nao-siga-receitas-de-redes-sociais/,Brazil,2020-06-05 00:00:00,481,explanation both drugs are effective in vitro but up to now have failed to cure covid19 on people,FALSE,https://www.poynter.org/?ifcn_misinformation=azithromycin-and-ivermectin-are-efficient-medicines-to-cure-covid-19, Estadão Verifica, azithromycin and ivermectin are efficient medicines to cure covid19
https://piaui.folha.uol.com.br/lupa/2020/06/05/verificamos-hospital-de-campanha-do-anhembi-vazio/,Brazil,2020-06-05 00:00:00,482,explanation this video is a 3minute edit of a longer video  in which the installations were shown in the original video  it is clearly stated that the wing is only being kept as a backup  in case the number of cases grow this part was cut the hospital currently has more than 400 patients in it,FALSE,https://www.poynter.org/?ifcn_misinformation=the-anhembi-field-hospital-in-sao-paulo-brasil-is-empty-a-video-allegedly-proves-it, Agência Lupa, the anhembi field hospital in são paulo brasil is empty a video allegedly proves it
https://piaui.folha.uol.com.br/lupa/2020/06/05/verificamos-tasuku-honjo-nobel-coronavirus-laboratorio/,Brazil,2020-06-05 00:00:00,483,explanation honjo himself publicly denied ever saying that he never worked in wuhan,FALSE,https://www.poynter.org/?ifcn_misinformation=tasuku-honjo-nobel-prize-winner-stated-that-the-sars-cov-2-was-made-in-a-lab-in-wuhan-where-he-used-to-work, Agência Lupa, tasuku honjo nobel prize winner stated that the sarscov2 was made in a lab in wuhan where he used to work
https://politica.estadao.com.br/blogs/estadao-verifica/publicacao-distorce-informacoes-sobre-protocolos-para-uso-de-medicamentos-contra-a-covid-19/,Brazil,2020-06-05 00:00:00,484,explanation there is no scientific evidence about efficacy of chloroquine and other drugs descripted on video,FALSE,https://www.poynter.org/?ifcn_misinformation=brazilia-president-jair-bolsonaro-was-right-about-efficacy-of-chloroquine, Estadão Verifica, brazilia president jair bolsonaro was right about efficacy of chloroquine
https://piaui.folha.uol.com.br/lupa/2020/06/04/verificamos-renata-vasconcellos-covid/,Brazil,2020-06-04 00:00:00,485,explanation she did not contract covid19 although she did not anchor jornal nacional on monday and tuesday june 1 and 2  she returned to the stand on june 3 she was gone for only 5 days  while the mandatory quarantine is of 14 days both her and globo denied it,FALSE,https://www.poynter.org/?ifcn_misinformation=renata-vasconcellos-one-of-brazils-most-famous-news-anchor-contracted-covid-19, Agência Lupa, renata vasconcellos one of brazils most famous news anchor contracted covid19
https://piaui.folha.uol.com.br/lupa/2020/06/04/verificamos-primeira-dama-unimed-hidroxicloroquina/,Brazil,2020-06-04 00:00:00,486,explanation this alledged protocol is not applied by the cias hospital  where she was treated for covid19 and released after four days this information was confirmed by unimed vitória  who manages the hospital,FALSE,https://www.poynter.org/?ifcn_misinformation=maria-virginia-casagrande-first-lady-of-the-brazilian-state-of-espirito-santo-was-cured-of-covid-19-after-being-treated-with-a-protocol-of-hydroxychloroquine-and-azithromycin, Agência Lupa, maria virgínia casagrande first lady of the brazilian state of espirito santo was cured of covid19 after being treated with a protocol of hydroxychloroquine and azithromycin
https://piaui.folha.uol.com.br/lupa/2020/06/03/verificamos-belem-nao-teve-nenhuma-morte-covid-19/,Brazil,2020-06-03 00:00:00,487,explanation according to the local health services  11 people died of covid19 on these two days numbers are not final,FALSE,https://www.poynter.org/?ifcn_misinformation=there-were-no-covid-19-deaths-in-belem-brazil-on-may-30-and-may-31, Agência Lupa, there were no covid19 deaths in belém brazil on may 30 and may 31
https://piaui.folha.uol.com.br/lupa/2020/06/03/verificamos-madagascar-oms-covid/,Brazil,2020-06-03 00:00:00,488,explanation rajoelina did not accuse the who of offering bribes,FALSE,https://www.poynter.org/?ifcn_misinformation=madagascars-president-andry-rajoelina-accused-the-who-of-promising-bribes-if-he-poisoned-an-alledged-local-covid-19-treatment, Agência Lupa, madagascars president andry rajoelina accused the who of promising bribes if he poisoned an alledged local covid19 treatment
https://piaui.folha.uol.com.br/lupa/2020/06/02/verificamos-saco-funeral-covid/,Brazil,2020-06-02 00:00:00,489,explanation the photos are from a protest in florida  us  not a funeral,FALSE,https://www.poynter.org/?ifcn_misinformation=a-photo-of-a-person-carrying-an-alledged-corpse-with-a-single-hand-the-caption-states-this-was-a-forged-funeral, Agência Lupa, a photo of a person carrying an alledged corpse with a single hand the caption states this was a forged funeral
https://politica.estadao.com.br/blogs/estadao-verifica/acao-da-pf-nao-reduziu-numero-de-mortes-no-ceara/,Brazil,2020-06-03 00:00:00,490,explanation official data shows a decrease lower than said on the post  it varies from 29 to 60 nevertheless  there is no link between a federal investigation launched to fight corruption and the number of cases,FALSE,https://www.poynter.org/?ifcn_misinformation=a-federal-investigation-in-the-city-of-fortaleza-brazil-made-number-of-daily-recorded-deaths-fall-90, Estadão Verifica, a federal investigation in the city of fortaleza brazil made number of daily recorded deaths fall 90
https://politica.estadao.com.br/blogs/estadao-verifica/e-falso-que-o-numero-de-casos-de-covid-19-seja-menor-que-o-oficial/,Brazil,2020-06-01 00:00:00,491,explanation the cause of the death is informed only after testing have a result in that way  no person that died from pneumonia was registered as a casualty of covid19,FALSE,https://www.poynter.org/?ifcn_misinformation=deaths-in-brazil-by-pneumonia-are-registered-as-covid-19, Estadão Verifica, deaths in brazil by pneumonia are registered as covid19
https://piaui.folha.uol.com.br/lupa/2020/06/02/verificamos-rio-obitos-policia/,Brazil,2020-06-02 00:00:00,492,explanation the police raid mentioned in this piece of content had nothing to do with rios city administration or the covid19 death records although the city administration did change its criteria  which means 1177 confirmed covid19 deaths were reclassified as suspected cases  the cause was not related to any police raids,FALSE,https://www.poynter.org/?ifcn_misinformation=after-a-police-raid-in-rio-the-city-administration-reduced-the-official-covid-19-death-toll-by-1-177, Agência Lupa, after a police raid in rio the city administration reduced the official covid19 death toll by 1177
https://politica.estadao.com.br/blogs/estadao-verifica/laranja-e-limao-com-mel-nao-previnem-contra-novo-coronavirus/,Brazil,2020-06-01 00:00:00,493,explanation there is no food  drug or substance that can make people immune to sarscov2 as of publication,FALSE,https://www.poynter.org/?ifcn_misinformation=orange-lemon-and-honey-prevent-from-being-infected-by-coronavirus, Estadão Verifica, orange lemon and honey prevent from being infected by coronavirus
https://piaui.folha.uol.com.br/lupa/2020/06/01/verificamos-ceara-obitos-coronavirus/,Brazil,2020-06-01 00:00:00,494,explanation covid19 deaths are not immediately registered on june 1  there were 20 confirmed covid19 deaths in fortaleza as of may 29,FALSE,https://www.poynter.org/?ifcn_misinformation=there-were-no-covid-19-deaths-in-fortaleza-brazil-on-may-29, Agência Lupa, there were no covid19 deaths in fortaleza brazil on may 29
https://www.aosfatos.org/noticias/homem-foi-encontrado-vivo-em-saco-funerario-na-bahia-em-2014-nao-recentemente/,Brazil,2020-05-29 00:00:00,495,explanation the news is from 2014 and has nothing to do with the new coronavirus pandemic,FALSE,https://www.poynter.org/?ifcn_misinformation=man-found-alive-in-burial-bag-in-the-brazilian-state-of-bahia, Aos Fatos, man found alive in burial bag in the brazilian state of bahia
https://politica.estadao.com.br/blogs/estadao-verifica/imagem-mostra-boneco-de-plastico-em-protesto-e-nao-corpo-carregado-so-por-uma-mao/,Brazil,2020-06-11 00:00:00,496,explanation video shows the making of a protest sacks were not filled with dead bodies from patients with covid19,FALSE,https://www.poynter.org/?ifcn_misinformation=video-shows-man-holding-bodies-in-sacks-with-only-one-hand, Estadão Verifica, video shows man holding bodies in sacks with only one hand
https://piaui.folha.uol.com.br/lupa/2020/06/10/verificamos-camara-mascara-casa/,Brazil,2020-06-10 00:00:00,497,explanation the bill approved by the congress demands people to wear masks only in public spaces or privatelyowned public areas like stores  restaurants or cinemas it does not include personal homes,FALSE,https://www.poynter.org/?ifcn_misinformation=the-brazilian-national-congress-approved-a-law-which-demands-you-to-wear-maks-inside-your-house-during-the-covid-19-pandemic-police-officers-will-be-allowed-to-enter-your-house-to-verify-if-youre-we, Agência Lupa, the brazilian national congress approved a law which demands you to wear maks inside your house during the covid19 pandemic police officers will be allowed to enter your house to verify if youre wearing a mask or not
https://www.aosfatos.org/noticias/haddad-nao-celebrou-aniversario-com-amigos-durante-pandemia-foto-e-de-2018/,Brazil,2020-06-10 00:00:00,498,explanation in addition to the image being recorded in 2018  haddad celebrates his birthday on january 25,FALSE,https://www.poynter.org/?ifcn_misinformation=former-candidate-for-the-presidency-of-brazil-from-the-workers-party-fernando-haddad-posted-a-photo-celebrating-his-birthday-with-guests-during-the-pandemic, Aos Fatos, former candidate for the presidency of brazil from the workers party fernando haddad posted a photo celebrating his birthday with guests during the pandemic
https://www.aosfatos.org/noticias/noticia-sobre-suicidio-de-empresario-que-demitiu-223-e-antiga-e-sem-relacao-com-pandemia/,Brazil,2020-06-10 00:00:00,499,explanation the news is from 2016 and has nothing to do with any pandemic,FALSE,https://www.poynter.org/?ifcn_misinformation=brazilian-company-owner-who-laid-off-employees-because-of-the-pandemic-commits-suicide, Aos Fatos, brazilian company owner who laid off employees because of the pandemic commits suicide
https://piaui.folha.uol.com.br/lupa/2020/06/09/verificamos-oms-assintomaticos-covid/,Brazil,2020-06-09 00:00:00,500,explanation although a who director did say asymptomatic cases rarely transmit covid19  the organization itself said this only applied to true asymptomatic  and not to presymptomatic cases also  no one ever said it was impossible,FALSE,https://www.poynter.org/?ifcn_misinformation=the-who-stated-that-asymptomatic-cases-of-covid-19-do-not-contribute-to-the-spread-the-disease, Agência Lupa, the who stated that asymptomatic cases of covid19 do not contribute to the spread the disease
https://www.aosfatos.org/noticias/governo-da-alemanha-nao-enviou-china-conta-bilionaria-de-prejuizos-com-pandemia/,Brazil,2020-06-09 00:00:00,501,explanation the figure was calculated and cited by the german tabloid bild in an editorial published on april 15 that defended the responsibility of chinese government officials for the economic losses of the new coronavirus pandemic it is not  therefore  the value of an account sent by the government  just an element that illustrates the newspapers arguments,FALSE,https://www.poynter.org/?ifcn_misinformation=germanys-government-has-sent-china-a-e149-billion-charge-for-damage-caused-by-the-pandemic, Aos Fatos, germanys government has sent china a 149 billion charge for damage caused by the pandemic
