checked_link,countries,date,id,justify,label,poynter_link,source,title
https://aosfatos.org/noticias/foto-de-policial-pisando-em-manifestante-foi-registrada-na-venezuela-nao-no-ceara/,Brazil,2020-04-20 00:00:00,656,explanation the image was recorded in july 2017 in caracas  venezuela  by photographer miguel gutierrez of the spanish news agency efe and shows the arrest of law student paula colmenárez  who was attending a protest against president nicolás maduro,FALSE,https://www.poynter.org/?ifcn_misinformation=police-officer-steps-on-woman-protesting-against-social-isolation-measures-in-ceara-a-brazilian-state, Aos Fatos, police officer steps on woman protesting against social isolation measures in ceará a brazilian state
https://piaui.folha.uol.com.br/lupa/2020/04/22/verificamos-fbi-mascaras-coronavirus/,Brazil,2020-04-22 00:00:00,657,explanation the n95 shown in the video were seized because they were being ilegally hoarded by an american individual they were distributed to hospitals in new york city after this incident,FALSE,https://www.poynter.org/?ifcn_misinformation=video-of-an-fbi-raid-in-the-captions-it-says-the-agents-were-seizing-chinese-n95-masks-that-were-contaminated-with-covid-19, Agência Lupa, video of an fbi raid in the captions it says the agents were seizing chinese n95 masks that were contaminated with covid19
https://aosfatos.org/noticias/e-falso-que-mascaras-importadas-da-china-estao-infectadas-com-o-novo-coronavirus/,Brazil,2020-04-22 00:00:00,658,explanation the misinformation was denied by the advisory of the brazilian ministry of health and contradicts the evidence that the virus does not survive for several days on surfaces  according to health authorities and a specialist consulted by aos fatos,FALSE,https://www.poynter.org/?ifcn_misinformation=chinese-masks-imported-by-brazilian-ministry-of-health-are-infected-with-the-new-coronavirus, Aos Fatos, chinese masks imported by brazilian ministry of health are infected with the new coronavirus
https://aosfatos.org/noticias/foto-de-hospital-recem-inaugurado-em-santo-andre-e-compartilhada-para-sugerir-que-sistema-de-saude-esta-vazio/,Brazil,2020-04-18 00:00:00,659,explanation the photo was taken at the pedro dellantonia complex field hospital in santo andré sp  which opened on april 15 the facility  however  only started to serve on the 17th  when three women were transferred according to the press office  the photo must have been taken between these events  that is  when the hospital was still not providing care,FALSE,https://www.poynter.org/?ifcn_misinformation=photo-of-hospital-with-empty-beds-shows-that-pandemic-effects-have-been-exaggerated-by-the-media-in-brazil, Aos Fatos, photo of hospital with empty beds shows that pandemic effects have been exaggerated by the media in brazil
https://piaui.folha.uol.com.br/lupa/2020/04/20/verificamos-joao-doria-festa-aracatuba/,Brazil,2020-04-20 00:00:00,660,explanation two pictures were shared with this claim one of them was shot in november 2019 he was visiting a factory in araçatuba the other one was during a trip to dubai  in february 2020 a few weeks before the first case of covid19 was registered in brazil,FALSE,https://www.poynter.org/?ifcn_misinformation=pictures-of-joao-doria-governor-of-sao-paulo-at-a-party-in-aracatuba-during-covid-19-lockdown, Agência Lupa, pictures of joão doria governor of são paulo at a party in araçatuba during covid19 lockdown
https://piaui.folha.uol.com.br/lupa/2020/04/20/verificamos-whatsapp-bloqueio-2020/,Brazil,2020-04-20 00:00:00,661,explanation the news report is from 2015  when whatsapp was supended for a few hours in brazil,FALSE,https://www.poynter.org/?ifcn_misinformation=a-video-of-a-news-report-claiming-whatsapp-is-going-to-be-suspended-in-brazil-on-the-caption-it-is-stated-that-the-suspension-is-going-to-take-place-because-of-misinformation-regarding-covid-19, Agência Lupa, a video of a news report claiming whatsapp is going to be suspended in brazil on the caption it is stated that the suspension is going to take place because of misinformation regarding covid19
https://aosfatos.org/noticias/e-falso-que-bolsonaro-disse-que-beneficiario-do-auxilio-emergencial-nao-gosta-de-trabalhar/,Brazil,2020-04-18 00:00:00,662,explanation the image that accompanies the publications text suggests that the statement was made on april 17  but a video shows that bolsonaro did not criticize the benefit at the time aos fatos didnt find any public records that show the president criticizing the aid recipients in fact  despite having only approved the r 600 benefit after pressure from congress  the government has been treating the granting of emergency aid as a political victory,FALSE,https://www.poynter.org/?ifcn_misinformation=brazilian-president-jair-bolsonaro-said-that-beneficiaries-of-r-600-emergency-aid-to-mitigate-the-effects-of-the-covid-19-pandemic-do-not-like-to-work, Aos Fatos, brazilian president jair bolsonaro said that beneficiaries of r  600 emergency aid to mitigate the effects of the covid19 pandemic do not like to work
https://piaui.folha.uol.com.br/lupa/2020/04/20/verificamos-heleno-coronavirus/,Brazil,2020-04-20 00:00:00,663,explanation the tweet was published by a fake account,FALSE,https://www.poynter.org/?ifcn_misinformation=a-alleged-tweet-from-general-heleno-minister-of-institutional-security-sort-of-like-ministry-for-the-interior-in-brazil-it-says-covid-19-is-not-strong-since-he-himself-and-president-jair-bolsonar, Agência Lupa, a alleged tweet from general heleno minister of institutional security sort of like ministry for the interior in brazil it says covid19 is not strong since he himself and president jair bolsonaro had it and recovered easily bolsonaro always denied having covid19
https://piaui.folha.uol.com.br/lupa/2020/04/20/verificamos-jovem-pisoteada-policial-ceara/,Brazil,2020-04-20 00:00:00,664,explanation the picture was taken in venezuela  in 2017,FALSE,https://www.poynter.org/?ifcn_misinformation=a-picture-of-a-girl-being-kicked-by-a-police-officer-on-a-motorbike-in-the-caption-it-says-the-pictures-was-taken-in-the-state-of-ceara-brazil-during-a-protest-against-lockdown, Agência Lupa, a picture of a girl being kicked by a police officer on a motorbike in the caption it says the pictures was taken in the state of ceará brazil during a protest against lockdown
https://aosfatos.org/noticias/foto-e-video-de-doria-em-aracatuba-sao-anteriores-pandemia-de-covid-19/,Brazil,2020-04-20 00:00:00,665,explanation all image records are prior to thecovid19 pandemic one of the photos is from 2010  when doria had not yet entered the political career,FALSE,https://www.poynter.org/?ifcn_misinformation=after-announcing-social-isolation-measures-governor-of-sao-paulo-joao-doria-appears-at-a-party-in-the-interior-of-the-state, Aos Fatos, after announcing social isolation measures governor of são paulo joão doria appears at a party in the interior of the state
https://aosfatos.org/noticias/video-de-militares-correndo-na-praia-e-antigo-e-nao-tem-relacao-com-isolamento-social/,Brazil,2020-04-20 00:00:00,666,explanation the video was recorded on september 2018  when jair bolsonaro and wilson witzel were still running for the brazilian election,FALSE,https://www.poynter.org/?ifcn_misinformation=military-men-run-on-a-beach-in-rio-de-janeiro-disrespecting-governor-wilson-witzels-isolation-measures, Aos Fatos, military men run on a beach in rio de janeiro disrespecting governor wilson witzels isolation measures
https://aosfatos.org/noticias/video-de-protesto-contra-governo-dilma-e-difundido-como-fosse-de-ato-pro-bolsonaro/,Brazil,2020-04-19 00:00:00,667,explanation the video was actually recorded during a protest in 2015 against the government of former president dilma rousseff at the time  210 thousand people reunited in são paulos most important avenue  paulista although there were protests in the city and elsewhere in the country over the past weekend  images show that the number of people was far less than recorded in the 2015 video,FALSE,https://www.poynter.org/?ifcn_misinformation=video-showing-crowded-sao-paulo-avenue-was-recorded-in-act-in-favor-of-president-jair-bolsonaro-and-against-coronavirus-safety-measures, Aos Fatos, video showing crowded são paulo avenue was recorded in act in favor of president jair bolsonaro and against coronavirus safety measures
https://aosfatos.org/noticias/e-falso-que-numero-de-mortes-por-covid-19-caiu-apos-moro-anunciar-investigacao/,Brazil,2020-04-17 00:00:00,668,explanation in addition to the ministry of justice having denied the existence of any investigation about the subject  data from the ministry of health show that the number of deaths continues to rise in the country,FALSE,https://www.poynter.org/?ifcn_misinformation=mortality-data-for-covid-19-declined-after-the-brazilian-justice-minister-announced-an-investigation, Aos Fatos, mortality data for covid19 declined after the brazilian justice minister announced an investigation
https://politica.estadao.com.br/blogs/estadao-verifica/video-e-usado-fora-de-contexto-para-relacionar-acao-da-pm-em-sao-paulo-a-pandemia-de-covid-19/,Brazil,2020-04-17 00:00:00,669,explanation the video has been circulating in twitter since december 2019  before epidemic began in brazil the man was attacked by police officers in mogi das cruzes  brazil  after a report of agression against a woman,FALSE,https://www.poynter.org/?ifcn_misinformation=a-video-shows-a-man-attacked-by-police-officers-because-he-was-walking-on-the-street-in-sao-paulo-during-the-covid-19-pandemic, Estadão Verifica, a video shows a man attacked by police officers because he was walking on the street in são paulo during the covid19 pandemic
https://piaui.folha.uol.com.br/lupa/2020/04/17/verificamos-mulher-agredida-guarda-bahia/,Brazil,2020-04-17 00:00:00,670,explanation although the video is recent  the police officers are breaking up a fight between two neighbours this is not related to lockdown,FALSE,https://www.poynter.org/?ifcn_misinformation=video-of-a-woman-being-pushed-by-a-police-officer-and-told-to-go-to-her-house-on-the-subtitles-it-is-said-that-this-happened-because-she-disrespected-lockdown-measures-in-bahia-brazil, Agência Lupa, video of a woman being pushed by a police officer and told to go to her house on the subtitles it is said that this happened because she disrespected lockdown measures in bahia brazil
https://piaui.folha.uol.com.br/lupa/2020/04/17/verificamos-mortes-covid-policia-federal/,Brazil,2020-04-17 00:00:00,671,explanation moro did not order such an investigation  and the number of deaths did not decrease actually  this friday  april 17  had the highest number of registered deaths since the beginning of the crisis,FALSE,https://www.poynter.org/?ifcn_misinformation=the-number-of-covid-19-deaths-in-brazil-plummeted-after-minister-of-justice-sergio-moro-ordered-the-federal-police-to-investigate-whether-the-numbers-were-being-fabricated, Agência Lupa, the number of covid19 deaths in brazil plummeted after minister of justice sergio moro ordered the federal police to investigate whether the numbers were being fabricated
https://piaui.folha.uol.com.br/lupa/2020/04/17/verificamos-video-abordagem-policial-mg-covid-19/,Brazil,2020-04-17 00:00:00,672,explanation although the video is recent  the people were not arrested because of lockdown the whole thing started because one suspect refused to be searched by the police  and than was forcefully arrested his family was nearby and  according to the police officers  started to fight them,FALSE,https://www.poynter.org/?ifcn_misinformation=a-video-of-police-officers-immobilizing-a-screaming-woman-the-caption-states-that-they-were-being-beaten-by-the-police-because-they-refuse-to-go-to-their-houses-during-lockdown-in-minas-gerais-brazi, Agência Lupa, a video of police officers immobilizing a screaming woman the caption states that they were being beaten by the police because they refuse to go to their houses during lockdown in minas gerais brazil
https://politica.estadao.com.br/blogs/estadao-verifica/e-falso-que-rodrigo-maia-tenha-descartado-projeto-sobre-estado-de-emergencia-em-fevereiro/,Brazil,2020-04-17 00:00:00,673,explanation the state of emergency bill was approved on the same day that it entered on the chamber of deputies agenda  in february 4,FALSE,https://www.poynter.org/?ifcn_misinformation=president-of-the-chambers-of-deputies-of-brazil-rodrigo-maia-ruled-out-a-state-of-emergency-bill-in-februrary-2019, Estadão Verifica, president of the chambers of deputies of brazil rodrigo maia ruled out a state of emergency bill in februrary 2019
https://aosfatos.org/noticias/tabela-que-compara-mortes-por-covid-19-com-outras-causas-traz-dados-falsos/,Brazil,2020-04-17 00:00:00,674,explanation the table shows data allegedly collected by datasus  the ministry of healths system according to the ministry  however  there are no consolidated mortality data available in brazil between the months of january and march 2020 that allow comparing the number of victims of covid19 with those of other causes  such as heart attack  cirrhosis and traffic accidents datasus releases mortality data every two years  and the latest numbers available are from 2018,FALSE,https://www.poynter.org/?ifcn_misinformation=table-that-compares-deaths-from-covid-19-with-other-causes-show-the-new-coronavirus-is-harmless, Aos Fatos, table that compares deaths from covid19 with other causes show the new coronavirus is harmless
https://politica.estadao.com.br/blogs/estadao-verifica/tabela-de-mortes-do-datasus-compartilhada-em-redes-sociais-tem-numeros-falsos/,Brazil,2020-04-15 00:00:00,675,explanation the numbers shown in the chart were invented,FALSE,https://www.poynter.org/?ifcn_misinformation=chart-shows-covid-19-kills-less-people-than-other-diseases, Estadão Verifica, chart shows covid19 kills less people than other diseases
https://politica.estadao.com.br/blogs/estadao-verifica/liberacao-de-uso-da-cloroquina-por-agencia-americana-nao-e-para-todos-os-pacientes-da-covid-19/,Brazil,2020-04-16 00:00:00,676,explanation fda has issued and emergency use authorization that does not mean it has approved the use of chloroquine against covid19 novartis has stated that chloroquine research is preliminary,FALSE,https://www.poynter.org/?ifcn_misinformation=a-viral-text-message-claims-fda-has-approved-the-use-of-chloroquine-for-all-covid-19-patients-and-pharma-company-novartis-has-announced-there-are-studies-proving-chloroquine-cures-covid-19, Estadão Verifica, a viral text message claims fda has approved the use of chloroquine for all covid19 patients and pharma company novartis has announced there are studies proving chloroquine cures covid19
https://piaui.folha.uol.com.br/lupa/2020/04/16/verificamos-medicos-30-paises-eficacia-cloroquina/?fbclid=IwAR0C4HGkHXPlY9NDQkJ1EEddRxkIeG2Bd-OG431-aiVty6EmsvjxJUhZeyc,Brazil,2020-04-16 00:00:00,677,explanation the poll the post refers to shows that azithromycin is the most popular treatment for covid19  while plasma from cured patients is viewed as the most effective hydroxychloroquine and chloroquine are in both lists  but not on top,FALSE,https://www.poynter.org/?ifcn_misinformation=a-poll-with-doctors-from-30-different-countries-confirm-that-chloroquine-is-the-most-effective-treatment-against-covid-19, Agência Lupa, a poll with doctors from 30 different countries confirm that chloroquine is the most effective treatment against covid19
https://piaui.folha.uol.com.br/lupa/2020/04/16/verificamos-ph-alimentos-covid/,Brazil,2020-04-16 00:00:00,678,explanation absolutely none of this is true there are no researches linking covid19 and acidity the humam body does not have a single ph  different parts of the body have different ph eating alkaline food does not affect the ph of the body and  finally  all the listed food itens  like nearly all food itens  have acidic ph  not alkaline,FALSE,https://www.poynter.org/?ifcn_misinformation=eating-alkaline-foods-are-an-effective-treatment-against-covid-19-sars-cov-2-does-not-survive-when-the-ph-of-the-body-is-above-5-5-a-few-food-itens-with-alkaline-ph-orange-lemon-avocado-pineappl, Agência Lupa, eating alkaline foods are an effective treatment against covid19 sarscov2 does not survive when the ph of the body is above 55 a few food itens with alkaline ph orange lemon avocado pineapple mango and garlic
https://aosfatos.org/noticias/e-falso-que-fda-aprovou-uso-da-hidroxicloroquina-para-todos-os-pacientes-com-covid-19/,Brazil,2020-04-15 00:00:00,679,explanation the agency allowed the emergencial use of the drug in some cases of hospitalized patients,FALSE,https://www.poynter.org/?ifcn_misinformation=the-fda-usas-food-and-drug-administration-has-approved-the-use-of-hydroxychloroquine-in-all-patients-with-covid-19, Aos Fatos, the fda usas food and drug administration has approved the use of hydroxychloroquine in all patients with covid19
https://piaui.folha.uol.com.br/lupa/2020/04/15/verificamos-guarda-municipal-sorocaba-coronavirus/,Brazil,2020-04-15 00:00:00,680,explanation the video is from december 7  2019 and  thus  not related to covid19 lockdown measures,False,https://www.poynter.org/?ifcn_misinformation=another-video-of-police-officers-beating-up-civilians-this-time-a-woman-again-the-caption-says-these-are-sao-paulo-military-police-officers-and-theyre-beating-her-up-because-she-violated-lockdown, Agência Lupa, another video of police officers beating up civilians this time a woman again the caption says these are são paulo military police officers and theyre beating her up because she violated lockdown
https://aosfatos.org/noticias/video-que-mostra-acao-da-pm-em-praia-e-antigo-e-sem-relacao-com-isolamento-social/,Brazil,2020-04-15 00:00:00,681,explanation the record was made in march 2019  in itapema in santa catarina state  when police officers tried to contain a fight between fans of a beach soccer championship,FALSE,https://www.poynter.org/?ifcn_misinformation=video-shows-brazilian-police-officers-expelling-people-from-beaches-with-pepper-spray-and-rubber-bullets-because-of-covid-19s-restrictive-measures, Aos Fatos, video shows brazilian police officers expelling people from beaches with pepper spray and rubber bullets because of covid19s restrictive measures
https://politica.estadao.com.br/blogs/estadao-verifica/e-falso-que-pesquisadores-de-harvard-tenham-concluido-que-isolamento-pode-piorar-a-situacao-da-covid-19/,Brazil,2020-04-15 00:00:00,682,explanation the study quoted says fast implementation of quarantine and social distancing can help slow down the pandemic of the new coronavirus,FALSE,https://www.poynter.org/?ifcn_misinformation=harvard-study-suggests-quarantine-can-worsen-covid-19-pandemic, Estadão Verifica, harvard study suggests quarantine can worsen covid19 pandemic
https://piaui.folha.uol.com.br/lupa/2020/04/15/quinino-agua-tonica-coronavirus/,Brazil,2020-04-15 00:00:00,683,explanation quinine is not the same thing as chloroquine the molecules are similar and both are effective against malaria  but they are different substances theres no research involving quinine for treating covid19 the minimum dosage for therapeutic use of quinine for malaria and other diseases is around 1g a day this would require the ingestion of 14 liters of tonic water finally  chloroquine is also not proven to be an effective medicine against covid19,False,https://www.poynter.org/?ifcn_misinformation=quinine-a-substance-present-in-tonic-water-is-the-same-thing-as-chloroquine-and-can-be-used-to-treat-covid-19, Agência Lupa, quinine a substance present in tonic water is the same thing as chloroquine and can be used to treat covid19
https://politica.estadao.com.br/blogs/estadao-verifica/desembargador-e-advogados-nao-acionaram-forcas-armadas-contra-stf-e-governadores/,Brazil,2020-04-15 00:00:00,684,explanation lawyer and judge denied writing the petition original petitito did not seek the arrestment of supreme court ministers nor state governors,FALSE,https://www.poynter.org/?ifcn_misinformation=judge-and-lawyers-wrote-petition-seeking-the-arrestment-of-supreme-court-ministers-and-state-governors-in-brazil, Estadão Verifica, judge and lawyers wrote petition seeking the arrestment of supreme court ministers and state governors in brazil
https://piaui.folha.uol.com.br/lupa/2020/04/15/verificamos-atriz-americana-cloroquina/,Brazil,2020-04-15 00:00:00,685,explanation she said the exact opposite in an interview at cbs  rita wilson said she was treated with chloroquine for covid19  but was not sure if it helped her at all also  she said the medication had severe side effects on her,False,https://www.poynter.org/?ifcn_misinformation=rita-wilson-tom-hanks-wife-stated-in-an-interview-at-cbs-that-she-wouldnt-be-alive-if-not-for-chloroquine, Agência Lupa, rita wilson tom hanks wife stated in an interview at cbs that she wouldnt be alive if not for chloroquine
https://piaui.folha.uol.com.br/lupa/2020/04/15/verificamos-video-saque-supermercado/,Brazil,2020-04-15 00:00:00,686,explanation the video was shot in honduras  2017  and has no relation whatsoever with covid19 lockdown measures,False,https://www.poynter.org/?ifcn_misinformation=a-video-of-a-supermarked-being-ransacked-the-caption-says-it-happened-in-the-brazilian-state-of-pernambuco-because-people-were-starving-because-they-were-not-allowed-to-work-during-lockdown, Agência Lupa, a video of a supermarked being ransacked the caption says it happened in the brazilian state of pernambuco because people were starving because they were not allowed to work during lockdown
https://aosfatos.org/noticias/e-falso-que-tv-italiana-noticiou-em-2015-que-novo-coronavirus-foi-criado-em-laboratorio/,Brazil,2020-04-15 00:00:00,687,explanation the virus mentioned in the program isnt sarscov2  but a synthetic form of shc014cov  found in bats the purpose of the study  carried out in 2015  was to determine if the virus was able to infect human beings if undergoing mutations recent research conducted in the usa has found no evidence that sarscov2  which causes covid19  was developed in the laboratory,FALSE,https://www.poynter.org/?ifcn_misinformation=italian-tv-program-showed-in-2015-that-the-new-coronavirus-was-created-by-scientists-in-an-experiment, Aos Fatos, italian tv program showed in 2015 that the new coronavirus was created by scientists in an experiment
https://politica.estadao.com.br/blogs/estadao-verifica/posts-inventam-desabafo-de-gusttavo-lima-sobre-ataques-contra-bolsonaro/,Brazil,2020-04-14 00:00:00,688,explanation there is no record of him saying that and he denied saying it,FALSE,https://www.poynter.org/?ifcn_misinformation=singer-gusttavo-lima-says-never-saw-a-president-being-so-humiliated-by-media-outlets, Estadão Verifica, singer gusttavo lima says never saw a president being so humiliated by media outlets
https://piaui.folha.uol.com.br/lupa/2020/04/15/verificamos-bretas-hidroxicloroquina/,Brazil,2020-04-15 00:00:00,689,explanation this was not tweeted by marcelo breta  but by a fake account,False,https://www.poynter.org/?ifcn_misinformation=a-tweet-allegedly-published-by-brazilian-judge-marcelo-bretas-in-which-he-states-that-hydroxychloroquine-makes-spending-with-expensive-hospital-equipments-unecessary-and-that-annoys-the-politicians, Agência Lupa, a tweet allegedly published by brazilian judge marcelo bretas in which he states that hydroxychloroquine makes spending with expensive hospital equipments unecessary and that annoys the politicians
https://aosfatos.org/noticias/alimentos-alcalinos-nao-ajudam-prevenir-ou-tratar-covid-19/,Brazil,2020-04-15 00:00:00,690,explanation aos fatos also did not find the study cited by the text  attributed to a virology center in moscow  russia health authorities in brazil and the world and experts consulted by aos fatos say there is no evidence that the virus can be contained or treated using a specific diet,FALSE,https://www.poynter.org/?ifcn_misinformation=alkaline-foods-help-prevent-or-treat-covid-19, Aos Fatos, alkaline foods help prevent or treat covid19
https://politica.estadao.com.br/blogs/estadao-verifica/video-e-tirado-de-contexto-para-distorcer-acoes-do-governo-doria-no-enfrentamento-a-covid-19/,Brazil,2020-04-14 00:00:00,691,explanation the publication uses an old video,FALSE,https://www.poynter.org/?ifcn_misinformation=governor-of-sao-paulo-brazil-ordered-police-to-beat-people-who-go-out-on-street, Estadão Verifica, governor of são paulo brazil ordered police to beat people who go out on street
https://piaui.folha.uol.com.br/lupa/2020/04/15/verificamos-praia-policia-coronavirus/,Brazil,2020-04-14 00:00:00,692,explanation the video is from 2019 and was not shot in são paulo  rio de janeiro or bahia  but in santa catarina,False,https://www.poynter.org/?ifcn_misinformation=a-video-of-people-on-a-beach-being-shot-at-by-police-officers-the-caption-says-that-police-forces-in-rio-de-janeiro-sao-paulo-and-bahia-are-now-allowed-to-shoot-anyone-who-violate-lockdown-measures, Agência Lupa, a video of people on a beach being shot at by police officers the caption says that police forces in rio de janeiro são paulo and bahia are now allowed to shoot anyone who violate lockdown measures
